{"decision":"quota_unknown","generated_date":"2026-10-19","pricing_coverage_basis_points":10000,"quota_coverage_basis_points":0,"schema_version":1,"unresolved":[{"decision":"unknown","failure_class":"no_reviewed_value","kind":"quota","original_date":null,"provider":"anthropic"},{"decision":"unknown","failure_class":"no_reviewed_value","kind":"quota","original_date":null,"provider":"google"},{"decision":"unknown","failure_class":"no_reviewed_value","kind":"quota","original_date":null,"provider":"openai"},{"decision":"unknown","failure_class":"no_reviewed_value","kind":"quota","original_date":null,"provider":"xai"}]}